Gender,First Name (Devanagari),Middle Name (Devanagari),Last Name (Devanagari),First Name (Roman),Middle Name (Roman),Last Name (Roman),Alternative Roman Spellings
1,सुजन,,अधिकारी,Sujan,,Adhikari,"Sujan Adhikari, Sujan  Adhikaari, Sujan Adikari"
0,प्रमीला,छेतेन,शेर्पा,Pramila,Chheten,Sherpa,"Pramila Chheten Sherpa, Pramila Sherpa, P. Sherpa"
0,अकालबुन,,मुसलमान,Akalbun,,Muslims,"Akalbun Muslim, Akalbun  Muslims, Akalbun Muslims"
0,ठूली,माया,बस्‍नेत,Thuli,Maya,Basnet,"Thuli Basne, Thuli Maya Basnet, Thuli Maya Baasnet"
1,सुरेश,कुमार,डगौरा,Suresh,Kumar,Dagaura,"Suresh K. Dagaura, Suresh Kumar Daagaauraa, S. Dagaura"
1,टोप,बहादुर,बोगटी,Top,Bahadur,Bogti,"T. Bogti, Top Bogti, Top Bogt"
0,जौमती,देवी,धामी,joumati,devi,dhami,"joumati devi dhami, j. dhami, joumati devi dhaami"
1,तुलाराम,ठाकुर,बरहि,Tularam,Thakur,Barhi,"T. Barhi, Tularam Barhi, Tularam Barh"
0,रमिला,,राई,Ramila,,Rai,"Ramila Rai, Ramila  Rai, Ramila . Rai"
0,शुस्मा,सुनार,वि.क.,Shusma,Goldsmith,V.K.,"Shusma G. V.K., Shusma V.K., Shusma Goldsmith V.K."
1,लोक,सिंह,साउद,Lok,Singh,Saund,"Lok S. Saund, Lok Singh Saund, Lok Singh Saaund"
0,सर्मीला,,राई,Sarmila,,Rai,"Sarmila Rai, S. Rai, Sarmila Ra"
0,कल्पना,,महत्रा,kalpana,,mahatra,"kalpana . mahatra, kalpana maatra, kalpana  mahatra"
0,मंगली,,देवी,mangli,,devi,"mangli devi, m. devi, mangli dev"
1,महेश,प्रसाद,साह,Mahesh,Prasad,Shah,"M. Shah, Mahesh P. Shah, Mahesh Sha"
0,तारा,,कार्की,tara,,karki,"tara karki, tara kark, tara  kaarki"
0,रस्मी,,के.सी.,Rasmi,,KC,"Rasmi  KC, R. KC, Rasmi . KC"
0,कमला,,गिरी,kamala,,giri,"kamala . giri, kamala giri, kamala  giri"
0,कमल,,कामी,Lotus,,Kami,"Lotus  Kaami, Lotus . Kami, Lotus  Kami"
1,कमल,,के.सी,Kamal,,KC,"K. KC, Kamal K, Kamal KC"
0,ललिता,,चौधरी,Lalita,,Choudhary,"L. Choudhary, Lalita . Choudhary, Lalita  Choudhari"
1,कृष्‍ण,नन्दन,पाल,Krishna,Nandan,Pal,"Krishna N. Pal, Krishna Nandan Paal, Krishna Pa"
0,पम्‍फा,,गौतम,Pampha,,Gautam,"Pampha  Gaautaam, Pampha Gautam, Pampha . Gautam"
1,शौलेन्द्र,,वातर,Shaulendra,,Vatar,"S. Vatar, Shaulendra Vatar, Shaulendra  Vaataar"
1,रोशन,,परियार,Roshan,,Pariyar,"Roshan . Pariyar, R. Pariyar, Roshan  Paariyaar"
1,टासी,ग्याल्वो,लामा,Tasi,Gyalvo,Lama,"Tasi Lam, Tasi Gyalvo Lama, T. Lama"
1,गौरब,,बलामी,Gaurav,,Balam,"Gaurav  Balam, Gaurav Balam, Gaurav . Balam"
0,प्रमिसा,,अर्याल,Pramisa,,Aryal,"Pramisa  Arial, Pramisa Arya, Pramisa  Aryal"
0,धन,कुमारी,खत्री,Dhan,Kumari,Khatri,"Dhan Khatri, Dhan Katri, Dhan K. Khatri"
0,मनसरा,,वली,Manasra,,Wali,"Manasra  Waali, M. Wali, Manasra . Wali"
1,पूर्ण,कुमार,श्रेष्‍ठ,Poorna,Kumar,Shrestha,"Poorna Kumar Shresthaa, Poorna Shrestha, Poorna Shresth"
1,विष्णु,लाल,प्रजा,Vishnu,Lal,Praja,"Vishnu Lal Praajaa, Vishnu Lal Praja, Vishnu Praja"
1,उमेश,,महतो,Umesh,,Mahato,"Umesh  Maahaato, Umesh Mahat, Umesh . Mahato"
0,मञ्जिला,,भण्डारी,floor,,steward,"floor steward, floor stewar, f. steward"
1,बाँधु,,थारु,Bandhu,,Tharu,"Bandhu . Tharu, Bandhu Tharu, Bandhu  Tharu"
1,सोनाम,,लिम्बु,Sonam,,Limbu,"Sonam . Limbu, Sonam  Limbu, Sonam Limb"
0,किर्तिका,,जोशी,Kirtika,,Joshi,"Kirtika  Joshi, Kirtika Josh, Kirtika Joshi"
0,चन्द्र,कुमारी,मगर,Chandra,Kumari,Magar,"Chandra Maga, Chandra Kumari Magar, Chandra Magar"
0,लक्ष्मी,,शाही,Laxmi,,Shahi,"Laxmi  Shaahi, Laxmi  Shahi, Laxmi . Shahi"
1,मुकेश,कुमार,चौधरी,Mukesh,Kumar,Chowdhary,"M. Chowdhary, Mukesh Kumar Chowdhari, Mukesh Chowdhar"
0,शर्मिला,,खनाल,Sharmila,,Khanal,"Sharmila  Khaanaal, Sharmila  Khanal, Sharmila Khanal"
0,धनिया,,चौधरी,Dhania,,Chowdhary,"Dhania  Chowdhary, Dhania Chowdhar, Dhania  Chowdhari"
1,मोहमद,राजा,हुसैन,mohammed,raja,hussein,"m. hussein, mohammed raja hussein, mohammed hussein"
0,ललिता,,लिम्बू,Lalita,,Limbu,"Lalita  Limbu, Lalita Limbu, Lalita . Limbu"
1,इन्द्र,बहादुर,विश्‍वकर्मा,Indra,Bahadur,Vishwakarma,"Indra Vishwakarm, Indra Bahadur Vishwaakaarmaa, Indra Bahadur Vishwakarma"
1,प्रकाश,दत्त,भट्ट,Prakash,Dutt,Bhatt,"Prakash Bhat, Prakash Bhatt, P. Bhatt"
1,नमराज,,भट्ट,Namaraj,,Bhatt,"Namaraj  Bhatt, Namaraj . Bhatt, N. Bhatt"
0,लक्ष्मी,,ढकाल,Lakshmi,,Dhakal,"Lakshmi Dhaka, Lakshmi Dhakal, Lakshmi  Dhaakaal"
0,मोतिकला,वि,क,Motila,,Vikas,"Motila  Vikas, M. Vikas, Motila Vikas"
0,नजवुन,,खातुन,Najvun,,Khatun,"Najvun  Khaatun, Najvun Khatun, Najvun . Khatun"
1,चन्द्र,कुमार,श्रेष्ठ,Chandra,Kumar,Shrestha,"Chandra Kumar Shrestha, Chandra K. Shrestha, C. Shrestha"
0,सितादेवी,,विश्‍वकर्मा,sitadevi,,vishwakarma,"sitadevi  vishwaakaarmaa, sitadevi viswakarma, s. vishwakarma"
1,सरोज,,भट्ट,Saroj,,Bhatt,"S. Bhatt, Saroj Bhat, Saroj Batt"
0,हिरादेवी,,शाह,Hiradevi,,Shah,"Hiradevi Sha, H. Shah, Hiradevi Sa"
0,बाँचा,,रावत,Bachha,,Rawat,"Bachha . Rawat, B. Rawat, Bachha Rawa"
0,अन्जली,कुमारी,ठाकुर,Anjali,Kumari,Thakur,"Anjali Thaku, A. Thakur, Anjali Thakur"
0,ध्रुवतारा,,थारु,Polestar,,Tharu,"Polestar . Tharu, Polestar  Tharu, Polestar Taru"
1,संजय,चौधरी,थारु,Sanjay,Chaudhary,Tharu,"Sanjay Chaudhary Tharu, Sanjay Taru, Sanjay Chaudhary Thaaru"
1,श्रीराम,,बलामी,Sriram,,Balami,"Sriram  Baalaami, Sriram Balam, S. Balami"
0,रुणा,,देवी,runa,,devi,"runa dev, runa  devi, r. devi"
1,राजाराम,,यादव,Rajaram,,Yadav,"R. Yadav, Rajaram  Yaadaav, Rajaram . Yadav"
1,दिना,साह,तेली,Dina,Shah,Teli,"Dina Tel, D. Teli, Dina S. Teli"
0,रेवती,,कवंर,Revati,,Kanwar,"Revati . Kanwar, Revati Kanwar, Revati Kanwa"
0,पवित्रा,,बिष्‍ट,Pavitra,,Bisht,"Pavitra  Bisht, Pavitra . Bisht, Pavitra Bist"
1,विनोद,,अधिकारी,Vinod,,Adhikari,"Vinod Adhikari, V. Adhikari, Vinod Adhikar"
1,मेघराज,,राई,Meghraj,,Rai,"Meghraj  Raai, Meghraj Ra, Meghraj Rai"
0,माया,देवी,उप्रेती,Maya,Devi,Upreti,"Maya D. Upreti, Maya Upreti, M. Upreti"
1,सुक,बहादुर,बि.के.,Suk,Bahadur,B.K.,"S. B.K., Suk B. B.K., Suk B.K"
1,सम,सुद्धीन,खान,Sam,Sudheen,Khan,"Sam S. Khan, Sam Sudheen Khan, Sam Sudheen Khaan"
0,सिता,आछामी,मगर,Sita,Achhami,Magar,"Sita Maga, Sita Magar, Sita Achhami Maagaar"
1,धरम,बहादुर,डगौरा,Dharam,Bahadur,Dagaura,"Dharam Bahadur Daagaauraa, Dharam B. Dagaura, Dharam Bahadur Dagaura"
1,फिरोज,,शेष,Feroz,,Shesh,"Feroz Shesh, Feroz Shes, F. Shesh"
0,भागी,कुमारी,मगर,ran,away,magar,"ran maga, ran magar, ran away maagaar"
0,दिल,कुमारी,घिमिरे,Dil,Kumari,Ghimire,"Dil Kumari Ghimire, Dil Ghimir, D. Ghimire"
1,रोहित,,दास,Rohit,,Das,"Rohit Das, Rohit  Das, R. Das"
0,फुलमती,,लोध,phulmati,,lodh,"phulmati lod, p. lodh, phulmati . lodh"
1,सलिम,,कवारि,Salim,,Kavari,"Salim Kavar, Salim  Kavari, S. Kavari"
1,हरि,राम,लोहार,Hari,Ram,Lohar,"Hari Ram Lohar, H. Lohar, Hari Loar"
0,सिमा,कुमारी,कुर्मी,Sima,Kumari,Kurmi,"S. Kurmi, Sima K. Kurmi, Sima Kurm"
1,सिद्धराज,,शाही,Siddhraj,,Shah,"Siddhraj Sa, Siddhraj  Shah, Siddhraj  Shaah"
0,सिता,कुमारी,श्रेष्‍ठ,Sita,Kumari,best,"Sita best, S. best, Sita bes"
1,श्रीराम,,आचार्य,shri,ram,acharya,"shri ram acharia, shri acarya, shri ram acharya"
0,सविता,देवी,चौधरी,Savita,Devi,Choudhary,"Savita Devi Choudhary, Savita D. Choudhary, S. Choudhary"
1,राम,किसुन,थारु,Ram,Kisun,Tharu,"Ram Kisun Tharu, Ram Thar, Ram Tharu"
0,कुसमावती,,मल्लाह,Kusmavati,,Mallah,"Kusmavati Mallah, Kusmavati  Maallaah, Kusmavati  Mallah"
1,डा.,प्रवेश,गौतम,Dr.,Pravesh,Gautam,"Dr. Pravesh Gautam, Dr. Pravesh Gaautaam, Dr. Gauta"
1,महेन्द्र,बहादुर,थापा,Mahendra,Bahadur,Thapa,"Mahendra Bahadur Thapa, Mahendra Thap, Mahendra B. Thapa"
1,बाल,कृष्ण,आचार्य,Bal,Krishna,Acharya,"Bal Krishna Acharia, Bal K. Acharya, Bal Acharya"
0,चौधरनिया,,थरुनी,Choudharaniya,,Tharuni,"Choudharaniya Taruni, Choudharaniya  Thaaruni, Choudharaniya Tharun"
1,इन्द्र,बहादुर,खड्गी,Indra,Bahadur,Khadgi,"Indra B. Khadgi, Indra Khadg, Indra Bahadur Khaadgi"
1,लिला,बहादुर,मगर,Leela,Bahadur,Magar,"Leela B. Magar, Leela Magar, L. Magar"
0,पवित्री,,थारु,Pavitri,,Tharu,"Pavitri  Thaaru, Pavitri  Tharu, Pavitri Tharu"
0,विमला,महतो,नुविया,Vimala,Mahato,Nuvia,"Vimala Nuvia, V. Nuvia, Vimala M. Nuvia"
0,मिना,,पन्त,Meena,,Pant,"Meena Pan, M. Pant, Meena  Paant"
0,कमला,सुनारी,मगर,kamala,goldsmith,alligator,"k. alligator, kamala goldsmith aalligaator, kamala alligator"
0,देवकला,,खाती,Devkala,,eats,"Devkala eats, Devkala . eats, D. eats"
1,अहि,मान,स्याङतान,ahi,maan,syatangan,"ahi syatangan, ahi maan syatangan, ahi syatanga"
0,तारा,,परियार,Tara,,Pariyar,"Tara Pariya, Tara Pariyar, Tara . Pariyar"
1,हरी,प्रसाद,श्रेष्ठ,Hari,Prasad,Shrestha,"H. Shrestha, Hari Prasad Shrestha, Hari Prasad Shresthaa"
0,नन्दा,,जोशी,nanda,,joshi,"nanda  joshi, nanda . joshi, nanda joshi"
0,सुष्‍मिता,,गुरुङ्ग,Sushmita,,Gurung,"Sushmita Gurun, Sushmita  Gurung, Sushmita . Gurung"
1,उदय,कुमार,यादव,Uday,Kumar,Yadav,"Uday Yada, Uday Yadav, Uday K. Yadav"
0,ज्ञानी,माया,गौतम,Gyani,Maya,Gautam,"Gyani M. Gautam, Gyani Maya Gaautaam, Gyani Maya Gautam"
0,सिता,,चौधरी,Sita,,Chowdhary,"Sita Chowdhar, Sita Chowdhary, Sita . Chowdhary"
0,अन्जु,,कोइराला,Anju,,Koirala,"Anju  Koiraalaa, Anju . Koirala, Anju  Koirala"
1,खगेन्द्र्,,निरौला,Khagendra,,Niraula,"Khagendra . Niraula, Khagendra Niraul, Khagendra Niraula"
0,कुसमी,देवी,मण्डल,Kusmi,Devi,Mandal,"K. Mandal, Kusmi Manda, Kusmi Mandal"
0,सिता,कुमारी,लिम्वु,Sita,Kumari,Limvu,"Sita Limvu, Sita K. Limvu, Sita Kumari Limvu"
1,टंक,प्रसाद,आचार्उय,Tank,Prasad,Acharya,"Tank P. Acharya, T. Acharya, Tank Acharya"
0,बसनधारा,,वि.क.,Basandhara,,V.K.,"Basandhara V.K., Basandhara V.K, B. V.K."
1,याम,प्रकाश,पौडेल,Yam,Prakash,Paudel,"Yam P. Paudel, Y. Paudel, Yam Paude"
0,रन्जिता,,स्याङतान,Ranjita,,Sayantan,"Ranjita Sayanta, Ranjita . Sayantan, Ranjita Sayantan"
0,मन्‍ती,,तामाङ,Manti,,Tamang,"Manti  Taamaang, Manti . Tamang, Manti Tamang"
1,काँसि,राम,सुनार,Bronze,Ram,Goldsmith,"Bronze Goldsmith, Bronze Ram Goldsmith, B. Goldsmith"
0,डिल,कुमारी,घिमिरे,Dill,Kumari,Ghimire,"Dill Gimire, Dill K. Ghimire, D. Ghimire"
1,धुइरे,राम,पार्की,Dhuire,Ram,Parki,"Dhuire Parki, Dhuire Park, Dhuire R. Parki"
1,शिव,बहादुर,कार्की,Shiv,Bahadur,Karki,"Shiv Kark, Shiv Karki, Shiv Bahadur Karki"
1,प्रसुन,मान,बज्राचार्य,Prasun,Maan,Bajracharya,"Prasun Bajrachary, Prasun Bajracharya, P. Bajracharya"
1,हरि,शरण,के.सी.,Hari,Sharan,K.C.,"Hari K.C, Hari K.C., Hari S. K.C."
0,मिना,,सुनार,Mina,,Goldsmith,"Mina  Goldsmith, Mina Goldsmith, Mina . Goldsmith"
0,हरि,माया,जिम्बा,Hari,Maya,Jimba,"Hari Maya Jimba, Hari Maya Jimbaa, H. Jimba"
1,पुजन,,लिम्बु,Pujan,,Limbu,"Pujan Limb, Pujan Limbu, Pujan  Limbu"
1,आषिष,,सुनार,ashish,,goldsmith,"a. goldsmith, ashish . goldsmith, ashish goldsmith"
1,विनय,,थोकर,Vinay,,Thokkar,"Vinay  Thokkaar, Vinay  Thokkar, Vinay . Thokkar"
1,केसु,राम,थारु,Kesu,Ram,Tharu,"Kesu Tharu, Kesu R. Tharu, Kesu Thar"
0,गोमा,,पाण्डे,Goma,,Pandey,"Goma . Pandey, Goma Pandey, Goma Pande"
1,अहमद,,देवान,Ahmed,,Dewan,"Ahmed  Dewaan, Ahmed Dewan, Ahmed . Dewan"
0,गौमती,देवी,गुरुङ,Gaumati,Devi,Gurung,"Gaumati D. Gurung, Gaumati Devi Gurung, G. Gurung"
0,लक्ष्मी,,लामा,Lakshmi,,Lama,"Lakshmi  Laamaa, Lakshmi Lam, Lakshmi Lama"
0,सम्झना,,सुनार,remember,,goldsmith,"remember goldsmit, remember . goldsmith, remember goldsmith"
0,अघनिया,,देवी,Aghaniya,,Devi,"Aghaniya Devi, Aghaniya . Devi, Aghaniya  Devi"
1,बसन्त,,पराजुली,Basant,,Parajuli,"B. Parajuli, Basant  Paaraajuli, Basant  Parajuli"
0,नगिना,,देवी,nagina,,devi,"nagina dev, nagina  devi, n. devi"
1,हरी,प्रसाद,जोशी,Hari,Prasad,Joshi,"H. Joshi, Hari P. Joshi, Hari Joshi"
0,भिमा,,कामी,Bhima,,Kami,"Bhima Kami, Bhima  Kami, Bhima . Kami"
1,पप्पु,कुमार,योगी,Pappu,Kumar,Yogi,"P. Yogi, Pappu Yogi, Pappu Yog"
0,रुची,,डंगोल,Ruchi,,Dangol,"Ruchi Dangol, Ruchi . Dangol, Ruchi Dango"
0,डम्बर,कुमारी,लावती,dumber,kumari,lavati,"d. lavati, dumber kumari laavaati, dumber k. lavati"
1,भिम,बहादुर,प्रधान,Bhim,Bahadur,Pradhan,"Bhim Bahadur Pradhan, Bhim Pradan, Bhim Pradhan"
1,लेख,बहादुर,आले,Article,Bahadur,Aale,"Article B. Aale, Article Aal, Article Aale"
0,सुनिरा,,विष्ट,Sunira,,Visht,"Sunira  Visht, S. Visht, Sunira Visht"
1,गोपाल,,श्रेष्‍ठ,Gopal,,Shrestha,"Gopal Shresth, Gopal Shrestha, Gopal  Shrestha"
1,सुवास,,पन्थ,Suwas,,Path,"S. Path, Suwas  Paath, Suwas . Path"
0,विष्णु,,पाण्डे,Vishnu,,Pandey,"Vishnu  Pandey, Vishnu Pandey, V. Pandey"
0,जनमा,कुमारी,शाही,Janma,Kumari,Shahi,"Janma Kumari Shahi, Janma Shahi, Janma K. Shahi"
0,मुनु,,राई,Munu,,Rai,"Munu . Rai, Munu Ra, Munu  Rai"
0,सितावरी,कुमारी,मोचीनी,Sitawari,Kumari,Mochini,"Sitawari K. Mochini, Sitawari Kumari Mochini, Sitawari Mochin"
1,राजेश,कुमार,थारु,Rajesh,Kumar,Tharu,"Rajesh Thar, R. Tharu, Rajesh Tharu"
0,गंगा,देवी,सुनारी,Ganga,Devi,Sunari,"Ganga Devi Sunari, Ganga D. Sunari, Ganga Sunari"
0,विनुता,हुमागाई,सापकोटा,Vinuta,Humagai,Sapkota,"Vinuta Sapkot, Vinuta Humagai Saapkotaa, V. Sapkota"
1,जयलाल,,महरा,Jaylal,,Mehra,"Jaylal Mehra, Jaylal . Mehra, J. Mehra"
0,बुद्धि,माया,विश्वकर्मा,Wisdom,Maya,Vishwakarma,"Wisdom Maya Vishwaakaarmaa, Wisdom Vishwakarm, Wisdom Vishwakarma"
1,धुमन,,राना,Dhuman,,Rana,"D. Rana, Dhuman Rana, Dhuman Ran"
1,बुध,,घले,Wed,,Ghle,"Wed Gle, Wed . Ghle, Wed  Ghle"
0,प्रेम,कुमारी,थारु,Prem,Kumari,Tharu,"Prem Thar, P. Tharu, Prem K. Tharu"
1,जुग,राम,थारु,Jug,Ram,Tharu,"Jug Thar, Jug Tharu, Jug Ram Thaaru"
1,जय,बहादुर,घिमिरे,Jai,Bahadur,Ghimire,"Jai Gimire, Jai B. Ghimire, J. Ghimire"
0,लक्ष्मी,,बाडे,Laxmi,,Bade,"Laxmi  Baade, Laxmi Bade, L. Bade"
1,बाल,गोविन्द,लोध,Bal,Govind,Lodh,"B. Lodh, Bal Lodh, Bal Govind Lodh"
0,प्रिति,,रिजाल,Preeti,,Rizal,"Preeti Riza, Preeti  Rizaal, Preeti  Rizal"
0,झुममाया,,राना,jhummaya,,rana,"jhummaya ran, jhummaya  raanaa, jhummaya  rana"
1,सत्य,नारायण,यादव,satya,narayan,yadav,"satya yada, satya yadav, satya narayan yaadaav"
1,लछीराम,,दमाई,Lachiram,,Damai,"Lachiram Damai, Lachiram  Daamaai, L. Damai"
0,धनसरी,,शाही,Dhansari,,Shahi,"Dhansari . Shahi, Dhansari Shah, Dhansari  Shaahi"
1,शुशिल,कुमार,महतो,Shushil,Kumar,Mahato,"Shushil K. Mahato, Shushil Mahat, Shushil Maato"
0,डम्वर,कुमारी,गुरागाई,Damvar,Kumari,Guragai,"Damvar K. Guragai, Damvar Guraga, Damvar Kumari Guraagaai"
0,भिम,माया,खड्का,Bhim,Maya,Khadka,"Bhim M. Khadka, Bhim Maya Khadka, Bhim Maya Khaadkaa"
0,समिक्षा,,थपलिया,Samiksha,,Thapaliya,"Samiksha  Thaapaaliyaa, Samiksha  Thapaliia, S. Thapaliya"
0,कविता,,विश्‍वकार्मा,Kavita,,Vishwakarma,"Kavita Vishwakarma, Kavita  Vishwaakaarmaa, Kavita . Vishwakarma"
1,केश,बहादुर,थापा,Kesh,Bahadur,Thapa,"Kesh Thap, K. Thapa, Kesh Bahadur Thapa"
0,विष्णु,कुमारी,बुढा,Vishnu,Kumari,Budha,"Vishnu Kumari Budha, Vishnu Budha, Vishnu Kumari Budhaa"
0,सरस्वती,,ढुङ्गाना,Saraswati,,Dhungana,"Saraswati Dhungana, Saraswati Dhungan, Saraswati . Dhungana"
0,ज्ञानु,कुमारी,सुनुवार,Gyan,Kumari,Sunuwar,"Gyan K. Sunuwar, Gyan Sunuwa, G. Sunuwar"
1,यम,बहादुर,गुरुङ्ग,Yam,Bahadur,Gurung,"Yam Gurun, Yam Bahadur Gurung, Yam B. Gurung"
0,रनिया,,देवी,Rania,,Devi,"R. Devi, Rania  Devi, Rania . Devi"
0,देव,माया,भट्टराई,Dev,Maya,Bhattarai,"D. Bhattarai, Dev Bhattarai, Dev Maya Bhaattaaraai"
0,रोवायदन,,खातुन,Rowaydan,,Khatun,"Rowaydan Katun, Rowaydan Khatun, Rowaydan Khatu"
1,बुद्धिराम,,थारु,Buddhiram,,Tharu,"Buddhiram . Tharu, Buddhiram Thar, Buddhiram Tharu"
1,कृष्ण,,साह,Krishna,,Shah,"Krishna . Shah, Krishna Sa, Krishna  Shah"
1,अरुण,भण्डारी,माली,Arun,Bhandari,Gardener,"Arun Gardener, Arun Gardene, A. Gardener"
0,पर्मिला,,थापा,Parmila,,Thapa,"Parmila Thapa, Parmila Tapa, P. Thapa"
1,किरण,,छन्त्याल,Kiran,,Chhantyal,"K. Chhantyal, Kiran  Chhantial, Kiran  Chhantyal"
1,बिजय,,विश्वकर्मा,Bijay,,Vishwakarma,"Bijay  Vishwakarma, B. Vishwakarma, Bijay Vishwakarma"
1,अमित,सोमै,मगर,Amit,Somay,Magar,"Amit Maga, Amit Magar, Amit Somay Magar"
0,भक्ति,माया,गुरुङ्ग,Bhakti,Maya,Gurung,"Bhakti Gurung, B. Gurung, Bhakti M. Gurung"
0,कमला,खनाल,(चापागाई),Kamala,Khanal,(Chapaagai),"Kamala (Capaagai), Kamala (Chapaagai, Kamala K. (Chapaagai)"
0,लीला,देवी,महरा,Leela,Devi,Mahara,"L. Mahara, Leela Mahara, Leela Devi Mahara"
1,अरविन्द,कुमार,वर्मा,Arvind,Kumar,Verma,"Arvind K. Verma, Arvind Verm, Arvind Verma"
1,गोविन्द,,शाही,govind,,shahi,"govind shah, govind  shahi, g. shahi"
1,राजेन्द्र,कुमार,(थारु),Rajendra,Kumar,(Tharu),"Rajendra (Tharu, R. (Tharu), Rajendra Kumar (Thaaru)"
0,शान्ती,,बराइली,Shanti,,Bareilly,"Shanti . Bareilly, Shanti Bareilly, Shanti Bareill"
1,रुपलाल,,चौधरी,Ruplal,,Chaudhary,"Ruplal Caudary, Ruplal  Chaudhary, Ruplal . Chaudhary"
1,गजिन्द्र,बहादुर,(क्षत्री),Gajinder,Bahadur,(Kshatriya),"Gajinder (Ksatriya), G. (Kshatriya), Gajinder (Kshatriya)"
1,सन्देश,,तमाङ,Sandesh,,Tamang,"Sandesh  Tamang, Sandesh . Tamang, Sandesh Tamang"
0,ईश्‍वरी,,मल्‍ल,Ishwari,,Mall,"Ishwari  Mall, I. Mall, Ishwari Mall"
0,द्रौपदी,,गुरुङ,draupadi,,gurung,"d. gurung, draupadi . gurung, draupadi  gurung"
1,ओम,प्रकाश,शर्मा,Om,Prakash,Sharma,"Om Prakash Shaarmaa, Om Sarma, Om Prakash Sharma"
1,समोझ,,राम,Samoj,,Ram,"Samoj  Raam, Samoj Ram, Samoj Ra"
0,क्षमा,देवी,ज्ञवाली,Kshama,Devi,Gyawali,"Kshama Devi Gyawali, Kshama Devi Giawali, Kshama Gyawal"
1,बिर,बहादुर,थापा,Bir,Bahadur,Thapa,"Bir Bahadur Thapa, Bir Thap, Bir Tapa"
0,राखी,,राजवंशी,Rakhi,,Rajvanshi,"Rakhi Rajvansh, Rakhi  Rajvanshi, Rakhi  Raajvaanshi"
1,पदम,बहादुर,मगर,Padam,Bahadur,Magar,"Padam Magar, P. Magar, Padam B. Magar"
1,रंजित,,यादव,ranjit,,yadav,"r. yadav, ranjit yadav, ranjit . yadav"
1,शरण,,पन्थी,refuge,,seeker,"r. seeker, refuge seeke, refuge  seeker"
0,ईनु,,ढुंगाना,inu,,dhungana,"inu dhungana, inu  dhungana, inu dungana"
1,पवन,सिह,धामी,Pawan,Singh,Dhami,"Pawan Dhami, Pawan Dham, Pawan S. Dhami"
1,कृष्‍ण,बहादुर,श्रेष्‍ठ,Krishna,Bahadur,Shrestha,"Krishna Shrestha, K. Shrestha, Krishna Sresta"
0,कान्छी,,तामाङ,kanchi,,tamaang,"kanchi  tamaang, kanchi  taamaaaang, kanchi tamaan"
1,भीम,बहादुर,कुवर,Bhim,Bahadur,Kunwar,"Bhim Kunwar, B. Kunwar, Bhim Kunwa"
0,सुरसती,,अहिरनी,Sursati,,Ahirni,"Sursati Airni, S. Ahirni, Sursati Ahirni"
1,बिक्रम,,कार्की,Bikram,,Karki,"Bikram . Karki, Bikram Kark, Bikram  Kaarki"
1,राजन,,शिल्पकार,Rajan,the,craftsman,"Rajan craftsman, Rajan the craftsman, R. craftsman"
1,सौरभ,,देवकोटा,Saurabh,,Devkota,"Saurabh Devkot, S. Devkota, Saurabh . Devkota"
1,मनोज,,चेम्जोङ,Manoj,,Chemjong,"M. Chemjong, Manoj Chemjong, Manoj  Chemjong"
0,मिना,,कुर्मी,Meena,,Kurmi,"Meena Kurmi, Meena . Kurmi, Meena  Kurmi"
1,चन्चल,,हजरा,Chanchal,,Hazra,"Chanchal Hazra, Chanchal Hazr, Chanchal  Haazraa"
0,जानकी,कुमारी,वोहरा,Janki,Kumari,Vohra,"Janki Vohr, Janki K. Vohra, Janki Vora"
1,प्रतीक,,अवस्थी,Prateek,,Awasthi,"P. Awasthi, Prateek Awasth, Prateek . Awasthi"
1,रुक,बहादुर,राना,Ruk,Bahadur,Rana,"R. Rana, Ruk Ran, Ruk Bahadur Raanaa"
1,पंकज,,यादव,Pankaj,,Yadav,"Pankaj  Yaadaav, P. Yadav, Pankaj Yada"
0,शुसिला,,चन्द,Shusila,,Chand,"Shusila Chan, Shusila  Chand, S. Chand"
0,धन,कुमारी,दर्जी,Dhan,Kumari,Tailor,"Dhan Tailo, Dhan Kumari Tailor, Dhan Kumari Taailor"
1,दामोदर,,भट्ट,Damodar,,Bhatt,"Damodar . Bhatt, D. Bhatt, Damodar Batt"
0,प्रेम,कुमारी,यादव,prem,kumari,yadav,"prem k. yadav, prem yada, prem kumari iadav"
1,अन्‍तराम,,बातर,Antaram,,Baatar,"Antaram  Baatar, Antaram Baatar, Antaram Baata"
0,दशनी,माया,माझी,Dashni,Maya,Majhi,"Dashni Majh, Dashni Maya Maajhi, Dashni Maji"
1,संजिब,,थारु,Sanjib,,Tharu,"Sanjib . Tharu, Sanjib  Tharu, Sanjib  Thaaru"
1,टेक,बहादुर,कुमाई,Tek,Bahadur,Kumai,"Tek Bahadur Kumaai, T. Kumai, Tek Kuma"
1,हुम,नाथ,भण्डारी,Hum,Nath,Bhandari,"Hum Bhandari, Hum Bandari, Hum Bhandar"
1,अकलेश,कुमार,यादव,Aklesh,Kumar,Yadav,"A. Yadav, Aklesh Kumar Yadav, Aklesh Yada"
1,अब्दुल,हासिफ,अन्सारी,Abdul,Hasif,Ansari,"Abdul H. Ansari, Abdul Ansar, Abdul Ansari"
1,उदान,कुमार,राई,Udan,Kumar,Rai,"U. Rai, Udan Rai, Udan Kumar Rai"
1,अजय,,पजियार,Ajay,,Pajiyar,"Ajay Pajiya, Ajay  Paajiyaar, Ajay Pajiyar"
0,मधु,कुमारी,घर्ति,Madhu,Kumari,Gharti,"Madhu K. Gharti, M. Gharti, Madhu Garti"
1,बलराम,,पराजुली,Balram,,Parajuli,"Balram . Parajuli, Balram  Paaraajuli, B. Parajuli"
1,दिपेन्‍द्र,,पौडेल,Dipendra,,Paudel,"D. Paudel, Dipendra  Paaudel, Dipendra . Paudel"
1,कुमार,,अधिकारी,Kumar,,Adhikari,"Kumar  Adhikari, Kumar . Adhikari, K. Adhikari"
1,वीर,बहादुर,तामाङ्ग,Veer,Bahadur,Tamang,"Veer Bahadur Tamang, V. Tamang, Veer Tamang"
1,कमल,,अधिकारी,Kamal,,Adhikari,"K. Adhikari, Kamal  Adhikaari, Kamal Adhikari"
1,चन्द्र,बहादुर,रोका,Chandra,Bahadur,Roka,"Chandra Rok, Chandra Bahadur Roka, C. Roka"
0,सुन्तली,,आचार्य,Suntali,,Acharya,"Suntali Acarya, Suntali . Acharya, Suntali Acharya"
0,रश्मी,भट्ट,न्यौपाने,Rashmi,Bhatt,Nyupane,"Rashmi Bhatt Nyupaane, Rashmi Bhatt Niupane, Rashmi B. Nyupane"
